{
  "schema": "aros-toolchain-source-lock-v2",
  "family": "llvm",
  "version": "11.0.0",
  "sources": [
    {
      "component": "clang",
      "version": "11.0.0",
      "purpose": "toolchain-component",
      "patch": "tools/crosstools/llvm/clang-11.0.0.src-aros.diff",
      "filename": "clang-11.0.0.src.tar.xz",
      "url": "https://github.com/llvm/llvm-project/releases/download/llvmorg-11.0.0/clang-11.0.0.src.tar.xz",
      "sha256": "0f96acace1e8326b39f220ba19e055ba99b0ab21c2475042dbc6a482649c5209",
      "size": 14982988
    },
    {
      "component": "compiler-rt",
      "version": "11.0.0",
      "purpose": "toolchain-component",
      "patch": "tools/crosstools/llvm/compiler-rt-11.0.0.src-aros.diff",
      "filename": "compiler-rt-11.0.0.src.tar.xz",
      "url": "https://github.com/llvm/llvm-project/releases/download/llvmorg-11.0.0/compiler-rt-11.0.0.src.tar.xz",
      "sha256": "374aff82ff573a449f9aabbd330a5d0a441181c535a3599996127378112db234",
      "size": 2141408
    },
    {
      "component": "libcxx",
      "version": "11.0.0",
      "purpose": "toolchain-component",
      "patch": "tools/crosstools/llvm/libcxx-11.0.0.src-aros.diff",
      "filename": "libcxx-11.0.0.src.tar.xz",
      "url": "https://github.com/llvm/llvm-project/releases/download/llvmorg-11.0.0/libcxx-11.0.0.src.tar.xz",
      "sha256": "6c1ee6690122f2711a77bc19241834a9219dda5036e1597bfa397f341a9b8b7a",
      "size": 1892416
    },
    {
      "component": "libcxxabi",
      "version": "11.0.0",
      "purpose": "toolchain-component",
      "patch": "tools/crosstools/llvm/libcxxabi-11.0.0.src-aros.diff",
      "filename": "libcxxabi-11.0.0.src.tar.xz",
      "url": "https://github.com/llvm/llvm-project/releases/download/llvmorg-11.0.0/libcxxabi-11.0.0.src.tar.xz",
      "sha256": "58697d4427b7a854ec7529337477eb4fba16407222390ad81a40d125673e4c15",
      "size": 554284
    },
    {
      "component": "libunwind",
      "version": "11.0.0",
      "purpose": "toolchain-component",
      "patch": "tools/crosstools/llvm/libunwind-11.0.0.src-aros.diff",
      "filename": "libunwind-11.0.0.src.tar.xz",
      "url": "https://github.com/llvm/llvm-project/releases/download/llvmorg-11.0.0/libunwind-11.0.0.src.tar.xz",
      "sha256": "8455011c33b14abfe57b2fd9803fb610316b16d4c9818bec552287e2ba68922f",
      "size": 97168
    },
    {
      "component": "lld",
      "version": "11.0.0",
      "purpose": "toolchain-component",
      "patch": "tools/crosstools/llvm/lld-11.0.0.src-aros.diff",
      "filename": "lld-11.0.0.src.tar.xz",
      "url": "https://github.com/llvm/llvm-project/releases/download/llvmorg-11.0.0/lld-11.0.0.src.tar.xz",
      "sha256": "efe7be4a7b7cdc6f3bcf222827c6f837439e6e656d12d6c885d5c8a80ff4fd1c",
      "size": 1247188
    },
    {
      "component": "llvm",
      "version": "11.0.0",
      "purpose": "toolchain-component",
      "patch": "tools/crosstools/llvm/llvm-11.0.0.src-aros.diff",
      "filename": "llvm-11.0.0.src.tar.xz",
      "url": "https://github.com/llvm/llvm-project/releases/download/llvmorg-11.0.0/llvm-11.0.0.src.tar.xz",
      "sha256": "913f68c898dfb4a03b397c5e11c6a2f39d0f22ed7665c9cefa87a34423a72469",
      "size": 39480848
    },
    {
      "component": "unicode-ucd",
      "version": "16.0.0",
      "purpose": "target-build-dependency",
      "filename": "UCD.zip",
      "url": "https://www.unicode.org/Public/16.0.0/ucd/UCD.zip",
      "sha256": "c86dd81f2b14a43b0cc064aa5f89aa7241386801e35c59c7984e579832634eb2",
      "size": 9020779
    }
  ],
  "host_python_packages": [
    {
      "name": "mako",
      "version": "1.3.10",
      "filename": "mako-1.3.10.tar.gz",
      "url": "https://files.pythonhosted.org/packages/9e/38/bd5b78a920a64d708fe6bc8e0a2c075e1389d53bef8413725c63ba041535/mako-1.3.10.tar.gz",
      "sha256": "99579a6f39583fa7e5630a28c3c1f440e4e97a414b80372649c0ce338da2ea28",
      "size": 392474,
      "source_root": "mako-1.3.10",
      "python_path": "."
    },
    {
      "name": "markupsafe",
      "version": "3.0.2",
      "filename": "markupsafe-3.0.2.tar.gz",
      "url": "https://files.pythonhosted.org/packages/b2/97/5d42485e71dfc078108a86d6de8fa46db44a1a9295e89c5d6d4a06e23a62/markupsafe-3.0.2.tar.gz",
      "sha256": "ee55d3edf80167e48ea11a923c7386f4669df67d7994554387f84e7d8b0a2bf0",
      "size": 20537,
      "source_root": "markupsafe-3.0.2",
      "python_path": "src"
    }
  ]
}
